{
  "cegs": "0.1",
  "id": "cegs:rel:ca:opg-darlington-proponent",
  "type": "relationship",
  "relationship_type": "proposes",
  "from": "cegs:org:ca:ontario-power-generation",
  "to": "cegs:project:ca:on:darlington-new-nuclear",
  "status": "VERIFIED",
  "valid_from": "2026-01-01T00:00:00Z",
  "valid_to": null,
  "evidence": ["cegs:evidence:ca:iaac-registry-darlington-smr"],
  "created_at": "2026-01-10T12:00:00Z"
}
